
mysql> use bd
Database changed
mysql> create table car(car_model int(20),car_name char(20),car_mileage int(20));
Query OK, 0 rows affected (0.02 sec)

mysql> desc car;
+-------------+----------+------+-----+---------+-------+
| Field       | Type     | Null | Key | Default | Extra |
+-------------+----------+------+-----+---------+-------+
| car_model   | int(20)  | YES  |     | NULL    |       |
| car_name    | char(20) | YES  |     | NULL    |       |
| car_mileage | int(20)  | YES  |     | NULL    |       |
+-------------+----------+------+-----+---------+-------+
3 rows in set (0.02 sec)

mysql> alter table car add car_rent int(20);
Query OK, 0 rows affected (0.03 sec)
Records: 0  Duplicates: 0  Warnings: 0

mysql> desc car;
+-------------+----------+------+-----+---------+-------+
| Field       | Type     | Null | Key | Default | Extra |
+-------------+----------+------+-----+---------+-------+
| car_model   | int(20)  | YES  |     | NULL    |       |
| car_name    | char(20) | YES  |     | NULL    |       |
| car_mileage | int(20)  | YES  |     | NULL    |       |
| car_rent    | int(20)  | YES  |     | NULL    |       |
+-------------+----------+------+-----+---------+-------+
4 rows in set (0.02 sec)

mysql> insert into car values(2000,'ford',20,1700),(2015,'honda fit',15,2001),(2021,'shift',13,1200),(2009,'tata',10,1200);
Query OK, 4 rows affected (0.01 sec)
Records: 4  Duplicates: 0  Warnings: 0

mysql> select*from car;
+-----------+-----------+-------------+----------+
| car_model | car_name  | car_mileage | car_rent |
+-----------+-----------+-------------+----------+
|      2000 | ford      |          20 |     1700 |
|      2015 | honda fit |          15 |     2001 |
|      2021 | shift     |          13 |     1200 |
|      2009 | tata      |          10 |     1200 |
+-----------+-----------+-------------+----------+
4 rows in set (0.00 sec)

mysql> create table company(c_name varchar(20),no_of_cars int(20),phn_no int(20));
Query OK, 0 rows affected (0.02 sec)

mysql> desc company;
+------------+-------------+------+-----+---------+-------+
| Field      | Type        | Null | Key | Default | Extra |
+------------+-------------+------+-----+---------+-------+
| c_name     | varchar(20) | YES  |     | NULL    |       |
| no_of_cars | int(20)     | YES  |     | NULL    |       |
| phn_no     | int(20)     | YES  |     | NULL    |       |
+------------+-------------+------+-----+---------+-------+
3 rows in set (0.02 sec)

mysql> insert into company values('SSR MOTORS',34,87564524),('MCR MOTORS',65,986764),('BMK MOTORS',35,987646);
Query OK, 3 rows affected (0.01 sec)
Records: 3  Duplicates: 0  Warnings: 0

mysql> SELECT*FROM company;
+------------+------------+----------+
| c_name     | no_of_cars | phn_no   |
+------------+------------+----------+
| SSR MOTORS |         34 | 87564524 |
| MCR MOTORS |         65 |   986764 |
| BMK MOTORS |         35 |   987646 |
+------------+------------+----------+
3 rows in set (0.00 sec)

mysql> delete from company where no_of_cars=24;
Query OK, 0 rows affected (0.00 sec)

mysql> select*from company;
+------------+------------+----------+
| c_name     | no_of_cars | phn_no   |
+------------+------------+----------+
| SSR MOTORS |         34 | 87564524 |
| MCR MOTORS |         65 |   986764 |
| BMK MOTORS |         35 |   987646 |
+------------+------------+----------+
3 rows in set (0.00 sec)

mysql> delete from company where no_of_cars=65;
Query OK, 1 row affected (0.01 sec)

mysql>  select*from company;
+------------+------------+----------+
| c_name     | no_of_cars | phn_no   |
+------------+------------+----------+
| SSR MOTORS |         34 | 87564524 |
| BMK MOTORS |         35 |   987646 |
+------------+------------+----------+
2 rows in set (0.00 sec)

mysql>